{
  "$schema": "http://json-schema.org/draft-07/schema#",
  "title": "Frameworks",
  "type": "array",
  "minItems": 1,
  "items": {
    "type": "object",
    "required": [
      "id",
      "name",
      "subtitle",
      "origin",
      "type",
      "linearity",
      "description",
      "stages",
      "bestFor",
      "special",
      "sourceLicense"
    ],
    "properties": {
      "id": {
        "type": "string",
        "pattern": "^[a-z][a-z0-9_]*$"
      },
      "name": {
        "oneOf": [
          {
            "type": "string"
          },
          {
            "type": "object",
            "required": [
              "pt-BR"
            ],
            "properties": {
              "pt-BR": {
                "type": "string"
              },
              "en": {
                "type": "string"
              },
              "es": {
                "type": "string"
              }
            },
            "additionalProperties": false
          }
        ]
      },
      "subtitle": {
        "oneOf": [
          {
            "type": "string"
          },
          {
            "type": "object",
            "required": [
              "pt-BR"
            ],
            "properties": {
              "pt-BR": {
                "type": "string"
              },
              "en": {
                "type": "string"
              },
              "es": {
                "type": "string"
              }
            },
            "additionalProperties": false
          }
        ]
      },
      "origin": {
        "oneOf": [
          {
            "type": "string"
          },
          {
            "type": "object",
            "required": [
              "pt-BR"
            ],
            "properties": {
              "pt-BR": {
                "type": "string"
              },
              "en": {
                "type": "string"
              },
              "es": {
                "type": "string"
              }
            },
            "additionalProperties": false
          }
        ]
      },
      "type": {
        "oneOf": [
          {
            "type": "string"
          },
          {
            "type": "object",
            "required": [
              "pt-BR"
            ],
            "properties": {
              "pt-BR": {
                "type": "string"
              },
              "en": {
                "type": "string"
              },
              "es": {
                "type": "string"
              }
            },
            "additionalProperties": false
          }
        ]
      },
      "linearity": {
        "oneOf": [
          {
            "type": "string"
          },
          {
            "type": "object",
            "required": [
              "pt-BR"
            ],
            "properties": {
              "pt-BR": {
                "type": "string"
              },
              "en": {
                "type": "string"
              },
              "es": {
                "type": "string"
              }
            },
            "additionalProperties": false
          }
        ]
      },
      "description": {
        "oneOf": [
          {
            "type": "string"
          },
          {
            "type": "object",
            "required": [
              "pt-BR"
            ],
            "properties": {
              "pt-BR": {
                "type": "string"
              },
              "en": {
                "type": "string"
              },
              "es": {
                "type": "string"
              }
            },
            "additionalProperties": false
          }
        ]
      },
      "sigla": {
        "oneOf": [
          {
            "type": "null"
          },
          {
            "type": "array",
            "items": {
              "type": "object",
              "required": [
                "letter",
                "meaning"
              ],
              "properties": {
                "letter": {
                  "type": "string"
                },
                "meaning": {
                  "oneOf": [
                    {
                      "type": "string"
                    },
                    {
                      "type": "object",
                      "required": [
                        "pt-BR"
                      ],
                      "properties": {
                        "pt-BR": {
                          "type": "string"
                        },
                        "en": {
                          "type": "string"
                        },
                        "es": {
                          "type": "string"
                        }
                      },
                      "additionalProperties": false
                    }
                  ]
                }
              },
              "additionalProperties": false
            }
          }
        ]
      },
      "stages": {
        "type": "array",
        "items": {
          "type": "string"
        }
      },
      "bestFor": {
        "type": "array",
        "items": {
          "oneOf": [
            {
              "type": "string"
            },
            {
              "type": "object",
              "required": [
                "pt-BR"
              ],
              "properties": {
                "pt-BR": {
                  "type": "string"
                },
                "en": {
                  "type": "string"
                },
                "es": {
                  "type": "string"
                }
              },
              "additionalProperties": false
            }
          ]
        }
      },
      "special": {
        "oneOf": [
          {
            "type": "string"
          },
          {
            "type": "object",
            "required": [
              "pt-BR"
            ],
            "properties": {
              "pt-BR": {
                "type": "string"
              },
              "en": {
                "type": "string"
              },
              "es": {
                "type": "string"
              }
            },
            "additionalProperties": false
          }
        ]
      },
      "sourceLicense": {
        "oneOf": [
          {
            "type": "string"
          },
          {
            "type": "object",
            "required": [
              "pt-BR"
            ],
            "properties": {
              "pt-BR": {
                "type": "string"
              },
              "en": {
                "type": "string"
              },
              "es": {
                "type": "string"
              }
            },
            "additionalProperties": false
          }
        ]
      }
    },
    "additionalProperties": false
  }
}